{
  "id": "spiderling",
  "name": "Spiderling",
  "speciesFamilyId": "cellar-vermin",
  "gradeBand": {
    "min": "F",
    "max": "D"
  },
  "trait": {
    "id": "eye-cluster",
    "name": "Eye Cluster",
    "description": "+5 Detection for the party; grows as it spots things first.",
    "effects": [
      {
        "kind": "buffStat",
        "stat": "detection",
        "amount": 5,
        "target": "allAllies",
        "note": "added to the party's best Detection"
      }
    ],
    "growsBy": "perception"
  },
  "actives": [
    {
      "skillId": "pet-spiderling-web-spit",
      "unlockLevel": 5
    },
    {
      "skillId": "pet-spiderling-venom-bite",
      "unlockLevel": 15
    }
  ],
  "stamina": 30,
  "baseStats": {
    "hp": 0.7,
    "attackPhys": 0.9,
    "defense": 0.7,
    "speed": 1.3,
    "detection": 1.2
  },
  "roleLean": "fierce",
  "visual": {
    "baseMesh": "spider",
    "palette": [
      "#2b2b33",
      "#6e5a7a",
      "#c8f0d0"
    ]
  },
  "eggSource": {
    "chestBand": "F",
    "familyId": "cellar-vermin"
  },
  "creationChoice": true
}
